一级专业代码,一级专业名称,二级专业代码,二级专业名称,三级专业代码,三级专业名称,类型,专业描述,授予学位,相近专业
10,医学,1002,临床医学类,100201k,临床医学,本科,"专业代码：100201K授予学位：医学学士修学年限：五年开设课程：主干学科：基础医学、临床医学。主要课程：人体解剖学、组织胚胎学、生理学、生物化学、药理学、病理学、预防医学、免疫学、诊断学、内科学、外科学、妇产科学、儿科学、中医学。主要实践性教学环节：毕业实习安排一般不少于48周。相近专业：麻醉学医学影像学医学检验放射医学视光学康复治疗学精神医学医学技术听力学医学实验学医疗美容技术医学影像技术康复治疗技术医学检验技术研究对象是各种疾病临床医学和基础医学专业是医学门类中最核心、最基础的专业，被考生广泛关注。主要研究疾病的病因、诊断、治疗和预后。临床医学专业的毕业生将来大多会从事临床工作，也就是医院中各科室的临床大夫。就业面窄医学是个经验型行业，医生的专业知识、技术经验、年龄阅历对未来的发展有着重要作用。据了解，由于学科的特殊性，医学专业就业面窄是不争的事实。尤其是临床医学，虽然每年的毕业生很多，但就业率并不特别高。我国大医院的体制基本都是国家事业单位，很多人都想进入大城市的大医院。公立医院编制有限，私立医院在中国的发展又很一般，因此无法消化每年大量的毕业生。不进大医院到哪儿去求职实际上，临床医学就业难大多是毕业生自己局限了求职范围。除了到三甲、二甲等医院就业以外，医学类专业的毕业生还有很多不错的发展方向。比如，基层医疗工作单位、健康管理中心、健康管理师、健康知识普及等。报考注意事项医学类专业的特点是培养周期长、课业负担重；对学生的身体条件和录取分数要求都较高,考生报考时一定要注意医学类院校和专业在身体、性别、科类等方面的要求。一些医学院和综合大学实施合作办学，有的专业是单独招生，有的专业在综合类大学中招生","",
10,医学,1002,临床医学类,100202TK,麻醉学,本科,专业代码：100202TK授予学位：医学学士修学年限：五年开设课程：主干学科：基础医学、临床医学、麻醉学。主要课程：人体解剖学、生理学、药理学、内科学、外科学、临床麻醉学、急救医学、疼痛诊疗学、麻醉药理学、麻醉设备学、麻醉生理学、麻醉解剖学。相近专业：临床医学医学影像学医学检验放射医学视光学康复治疗学精神医学医学技术听力学医学实验学医疗美容技术医学影像技术康复治疗技术医学检验技术主要实践教学环节包括临床见习、毕业实习一般应安排52周培养目标本专业培养具有基础医学、临床医学和麻醉学等方面的基本理论知识和基本技能，能在医疗卫生单位的麻醉科、急诊科、急救中心、重症监测治疗病房(ICU)、药物依赖戒断及疼痛诊疗等领域从事临床麻醉、急救和复苏、术后监测、生理机能调控等方面工作的医学高级专门人才。专业培养要求本专业学生主要学习基础医学、临床医学、麻醉学的基本理论知识及临床医学、麻醉学的基本技术，接受麻醉、急救与生命复苏的基本训练，具有常见手术的麻醉处理、手术期并发症防治以及危重病症的监测、判断与治疗的基本能力。毕业生具备的专业知识与能力1.掌握基础医学、临床医学和麻醉学的基本理论、基本知识；2.掌握临床诊疗工作的辩证思维和分析判断方法；3.具有对常见病、多发病以及疼痛诊治的初步能力，具有对常见手术麻醉处理、围麻醉期并发症防治和危重病症监测、判断和治疗的基本能力；4.具有急救和生命复苏的基本能力；5.熟悉国家卫生工作方针、政策和法规；6.掌握文献检索、资料查询、计算机应用及统计分析的基本方法，具有一定的科学研究和实际工作能力。,"医学学士", 医学信息工程 制药工程 生物医学工程 动物医学类 动物医学 动物药学 基础医学 临床医学 医学影像学 精神医学 放射医学 口腔医学类 口腔医学 公共卫生与预防医学.. 预防医学 卫生监督 中医学 针
10,医学,1002,临床医学类,100203TK,医学影像学,本科,专业代码：100203TK授予学位：医学学士修学年限：四年开设课程：物理学、电子学基础、计算机原理与接口、影像设备结构与维修、医学成像技术、摄影学、人体解剖学、诊断学、内科学、影像诊断学、核医学、医学影像解剖学、肿瘤放疗治疗学、B超诊断学等。主要实践教学环节包括临床见习、毕业实习等。培养目标本专业培养具有基础医学、临床医学和现代医学影像学的基本理论知识及能力，能在医疗卫生单位从事医学影像诊断、介入放射学和医学成像技术等方面工作的医学高级专门人才。专业培养要求本专业学生主要学习基础医学、临床医学、医学影像学的基本理论知识，受到常规放射学、CT、磁共振、超声学、DSA、核医学影像学等操作技能的基本训练，具有常见病的影像诊断和介入放射学操作基本能力。毕业生具备的专业知识与能力1.掌握基础医学、临床医学、电子学的基本理论、基本知识；2.掌握医学影像学范畴内各项技术(包括常规放射学、CT、核磁共振、DSA、超声学、核医学、影像学等)及计算机的基本理论和操作技能；3.具有运用各种影像诊断技术进行疾病诊断的能力；4.熟悉有关放射防护的方针，政策和方法，熟悉相关的医学伦理学；5.了解医学影像学各专业分支的理论前沿和发展动态；6.掌握文献检索、资料查询、计算机应用的基本方法，具有一定的科学研究和实际工作能力。,"医学学士",
10,医学,1002,临床医学类,100204TK,眼视光医学,本科,专业代码：100204TK授予学位：医学学士修学年限：四年开设课程：人体解剖学（含组织胚胎学）、生理学、诊断学基础、药理学、基础眼科学、视光学基础、眼视光特检技术、内科学、外科学、验光技术、临床眼科学、眼镜技术、配镜学、角膜接触镜验配技术等。主要实践教学环节包括临床见习、毕业实习等。培养目标本专业培养具有基础医学、临床医学和眼视光医学的基本理论知识及能力，能在医疗卫生单位从事眼科诊断、治疗和医学技术等方面工作的医学高级专门人才。专业培养要求本专业学生主要学习基础医学、临床医学、眼视光医学的基本理论知识，受到专业操作技能的基本训练，具有常见眼病诊断治疗的基本能力。毕业生具备的专业知识与能力1.掌握基础医学、临床医学、眼视光医学的基本理论、基本知识；2.掌握眼视光医学及计算机的基本理论和操作技能；3.具有运用眼视光医学诊断治疗疾病的能力；4.熟悉有关眼视光医学方针、政策和方法；5.了解眼视光医学各专业分支的理论前沿和发展动态；6.掌握文献检索、资料查询、计算机应用的基本方法，具有一定的科学研究和实际工作能力。,"",
10,医学,1002,临床医学类,100205TK,精神医学,本科,专业代码：100205TK授予学位：医学学士修学年限：五年开设课程：医学、临床医学、临床心理学、行为医学、儿童精神医学、精神病学等。就业方向：全国各级医学院校、综合医院、脑科医院、医学心理中心及精神卫生保健等。主要实践教学环节包括临床见习、毕业实习等培养目标本专业基础宽厚，毕业后能在综合医院或专科医院从事临床精神病学、心理咨询心理治疗工作的高级医学人才。专业培养要求本专业要求学生掌握基础医学、临床医学、临床心理学及精神病的基本理论和诊疗技能，具有一般医疗技能和处理常见的心理障碍、行为障碍、精神疾病及相关疑难急重症的能力。毕业生具备的专业知识与能力1.掌握基础医学、临床医学、精神医学的基本理论、基本知识；2.掌握精神医学及计算机的基本理论和操作技能；3.具有运用精神医学诊断及防治疾病的能力；4.熟悉有关精神医学方针、政策和方法；5.了解精神医学各专业分支的理论前沿和发展动态；6.掌握文献检索、资料查询、计算机应用的基本方法，具有一定的科学研究和实际工作能力。,"医学学士", 医学信息工程 制药工程 生物医学工程 动物医学类 动物医学 动物药学 基础医学 临床医学 麻醉学 医学影像学 放射医学 口腔医学类 口腔医学 公共卫生与预防医学.. 预防医学 卫生监督 中医学 针灸
10,医学,1002,临床医学类,100206TK,放射医学,本科,专业代码：100206TK授予学位：医学学士修学年限：四年开设课程：解剖学、组织与胚胎学、病原学、免疫学、生物化学、生理学、病理学、药理学、临床医学导论、内科学、外科学、预防医学、放射医学及防护、影像诊断学、肿瘤放射治疗学、核医学。相近专业：临床医学麻醉学医学检验眼视光学康复治疗学精神医学医学技术听力学医学实验学医疗美容技术医学影像技术主要实践教学环节包括临床见习、毕业实习等。培养目标本专业培养从事放射医学及防护、放射病诊治、核医学及医学影像等工作的德智体全面发展的、具有创新精神和系统的放射医学理论与实践能力的临床医师。专业培养要求本专业学生主要学习基础医学、临床医学、放射医学的基础知识；用放射诊断、核素诊断、影像诊断等各种诊断技术进行疾病诊断，并掌握其基本理论、方法和技能；应用γ射线、深部X射线、放射性核素等各种射线进行诊断及放射治疗，并掌握其基本理论、方法和技能；放射损伤及放射病的诊治技术；放射防护的基本理论、方法和技能；医学科学研究的初步能力。毕业生具备的专业知识与能力1.掌握基础医学、临床医学、放射医学的基本理论、基本知识；2.掌握放射医学及计算机的基本理论和操作技能；3.具有运用放射医学诊断及防治疾病的能力；4.熟悉有关放射医学方针、政策和方法；5.了解放射医学各专业分支的理论前沿和发展动态；6.掌握文献检索、资料查询、计算机应用的基本方法，具有一定的科学研究和实际工作能力。,"医学学士", 医学信息工程 制药工程 生物医学工程 动物医学类 动物医学 动物药学 基础医学 临床医学 麻醉学 医学影像学 精神医学 口腔医学类 口腔医学 公共卫生与预防医学.. 预防医学 卫生监督 中医学 针灸
10,医学,1003,口腔医学类,100301k,口腔医学,本科,专业代码：100301K授予学位：医学修学年限：四年开设课程：主干学科：基础医学、临床医学、口腔医学。主要课程：物理学、生物学、口腔解剖生理学、口腔组织病理学、口腔材料学、口腔内科学、口腔颌面外科学、口腔修复学、口腔正畸学。主要实践性教学环节：包括口腔内科、口腔外科和口腔修复等学科的毕业实习，一般安排36-42周。相近专业：口腔修复工艺学中西医临床医学主要实践教学环节包括口腔内科、口腔外科和口腔修复等学科的毕业实习，一般安排36-42周。培养目标本专业培养具备医学基础理论和临床医学知识，掌握口腔医学的基本理论和临床操作技能，能在医疗卫生机构从事口腔常见病、多发病的诊治、修复和与预防工作的医学高级专门人才。专业培养要求本专业学生主要学习口腔医学的基本理论和基本知识，受到口腔及颌面部疾病的诊断、治疗、预防方面的训练，具有口腔常见病、多发病的诊疗、修复和预防保健的基本能力。毕业生具备的专业知识与能力1.掌握基础医学和临床医学的基本理论知识和实验技能；2.掌握口腔医学各学科的基本理论知识和医疗技能；3.具有口腔及颌面部常见病、多发病的诊治和急、难、重症的初步处理的能力；4.具有口腔修复工作的基本知识和-般操作技能；5.熟悉国家卫生工作方针、政策和法规；,"", 临床医学类 临床医学 中医学 蒙医学 藏医学 维医学 中西医结合 针灸推拿 中医骨伤
10,医学,1004,公共卫生与预防医学类,100401k,预防医学,本科,专业代码：100401K授予学位：医学学士修学年限：四年开设课程：主干学科：基础医学、预防医学。主要课程：细胞生物学、人体解剖学、组织胚胎学；生物化学、生理学、病理学、病理生理学、人体寄生虫学、医学微生物学、免疫学、药理学；卫生化学、毒理学、诊断学、卫生统计学、流行病学、职业卫生与职业医学；环境卫生学、营养与食品卫生学、儿童少年卫生学、卫生法学、卫生经济学、医学伦理学等。相近专业：眼视光学卫生信息管理卫生监督职业病防治主要实践教学环节临床实践等培养目标本专业培养具备预防医学基本理论知识和卫生检测技术，能在卫生防疫、环境卫生或食品卫生监测等机构从事预防医学工作的医学高级专门人才。专业培养要求本专业学生主要学习基础医学、预防医学的基本理论知识，受到卫生检测技术、疾病控制的基本训练，具有卫生防疫、控制传染病与职业病、改进人群环境卫生条件、实施食品卫生监督等工作的基本能力。毕业生具备的专业知识与能力1.掌握预防医学的基本理论知识和防疫工作的基本能力；2.掌握对人群劳动、生活、学习、环境和食品进行卫生检测和监督的基本能力；3.具有分析影响人群健康的各种因素和疾病流行规律，制定预防疾病和增进人群健康措施与计划的能力；4.熟悉国家卫生工作方针、政策和法规；5.熟悉临床医学的基本理论知识和常见病、多发病的防治技术，熟悉健康教育工作；6.掌握文献检索、资料查询、计算机应用及统计分析的基本方法，具有-定的科学研究和实际工作能力。,"医学学士",
10,医学,1004,公共卫生与预防医学类,100402,食品卫生与营养学,本科,专业代码：100402授予学位：医学学士修学年限：五年开设课程：基础医学、临床医学、中医学基础、解剖生理学、病理学、中药学、方剂学、病理学、药理学、食品微生物学、食品毒理学、食品卫生学、烹饪学基础、临床营养学等。培养目标培养具有良好的职业道德，系统掌握医学基础知识、临床技能和营养及食品卫生知识，能从事营养食品卫生监督、检测、生产管理的卫生专业人才。专业培养要求本专业学生应掌握基础医学、临床医学、营养与食品卫生的基本知识及基本技能，熟练掌握流行病学、卫生统计学的基本理论、方法和卫生防疫技能。毕业生具备的专业知识与能力1.掌握食品卫生与营养学的基本理论知识；2.掌握基础医学、临床医学、营养与食品卫生的基本理论知识及食品卫生检测技能；3.能够从事营养与食品卫生的监督、检测和管理工作；熟悉国家的食品卫生法规；4.具有一定的社会医学知识、劳动卫生、环境卫生和职业病知识，具有调查、研究的能力和科学的思维方法。,"",
10,医学,1004,公共卫生预防医学类,100403TK,妇幼保健医学,本科,专业代码：100403TK授予学位：医学学士修学年限：四年开设课程：人体解剖学、组织胚胎学、生理学、病理学、遗传与优生学、生殖内分泌与免疫、内科学、外科学、儿科学、妇产科学、生殖健康、妇幼与儿少卫生、妇女保健学、儿童保健学妇幼营养学、妇幼心理学、妇幼卫生管理、流行病学、性医学等。相近专业：基础医学临床医学预防医学卫生检验护理学中西医临床医学主要实践教学环节包括临床见习、毕业实习等。培养目标本专业旨在培养掌握妇幼保健基础医学知识，具备基础医学、临床医学和预防医学方面的基本技能，能通过国家执业医师资格考试，能在基层从事妇幼保健和妇产科、儿科常见病的防治，具有初步处理妇产科急诊、产科大出血及计划生育、围产期保健的能力，也能在妇幼保健业务及行政部门从事临床、预防、科研、管理等方面工作的医学高级妇幼保健专门人才。专业培养要求本专业学生主要学习临床医学和预防医学基础理论和基本知识，接受疾病诊断、治疗、预防、保健及管理方面的基本训练，具有妇幼卫生管理和改善妇幼卫生服务的能力以及妇幼健康的调查研究、临床试验及科学评价的能力。毕业生具备的专业知识与能力1.掌握基础医学和预防医学和临床医学的基本理论、基本知识；2.掌握妇女和儿童常见病、多发病诊断处理的临床基本技能；3.具有对急、难、重症的初步处理能力；4.具有从事有关妇幼健康的调查研究、临床试验及科学评价的能力；5.具有妇幼卫生管理和改善妇幼卫生服务的能力；6.熟悉国家卫生工作方针、政策和法规；7.掌握医学文献检索、资料调查的基本方法，具有一定科学研究能力；8.掌握一门外语，具有一定听说读写能力，能较熟练地阅读专业外语书刊；9.具有计算机应用的基本能力。,"",
10,医学,1004,公共卫生预防医学类,100404TK,卫生监督,本科,专业代码：100404TK授予学位：医学学士修学年限：四年开设课程：正常人体学概论、医学微生物学基础、病理学基础、临床医学概论、卫生统计学、流行病学基础、环境卫生学、劳动卫生与职业病、营养与食品卫生、学校卫生、行政法学基础、卫生法学概论、卫生事业管理等。主要实践教学环节包括公共卫生监督实习、临床实习、专业实习等等。培养目标本专业培养掌握医学和卫生监督执法的基本知识与技能，从事卫生执法与卫生监督工作的高级管理人才。专业培养要求本专业学生主要学习卫生监督的基础理论和基本知识，接受卫生监督方面的基本训练，具有实际工作的能力。毕业生具备的专业知识与能力1.掌握卫生监督的基本理论、基本知识；2.掌握卫生监督基本技能；3.具有对卫生问题的初步处理能力；4.具有从事有关工作的能力；5.熟悉国家卫生工作方针、政策和法规；6.掌握医学文献检索、资料调查的基本方法，具有一定科学研究能力；,"", 卫生管理类 卫生信息管理 公共卫生管理 医学文秘
10,医学,1004,公共卫生预防医学类,100405TK,全球健康学,本科,专业代码：100405TK授予学位：医学学士修学年限：四年开设课程：全球健康概论、基础医学概论、公共卫生概论、心理学、全球文化概论等。主要实践教学环节包括课程实习、毕业实习等等。培养目标本专业培养德智体全面发展，系统掌握全球健康的基本理论、基础方法和基本技能，受过科学研究和实践训练，善于沟通协调的复合型领军人才；具有良好的国际化合作和交流能力，能承担全球健康领域的理论研究、政策评估、国际卫生资源整合和全球疾病控制等方面的工作。专业培养要求本专业学生主要学习全球健康学的基础理论和基本知识，接受全球健康学方面的基本训练，具有良好的国际化合作和交流能力，能承担全球健康领域的理论研究、政策评估、国际卫生资源整合和全球疾病控制等方面的工作。毕业生具备的专业知识与能力1.掌握全球健康学的基本理论、基本知识；2.掌握全球健康学基本技能；3.具有对卫生问题的初步处理能力；4.具有具有良好的国际化合作和交流能力；5.熟悉全球健康学的方针、政策和法规；6.掌握医学文献检索、资料调查的基本方法，具有一定科学研究能力。,"",
10,医学,1005,中医学类,100501k,中医学,本科,专业代码：100501K授予学位：医学学士修学年限：五年制开设课程：医古文、英语、中医基础理论、中医诊断学、中药学、方剂学、内经选读、伤寒论选读、金匮要略选读、温病学、中医内科学、中医外科学、中医妇科学、中医儿科学、针灸学、人体解剖学、组织学与胚胎学、生理学、生物化学、病理学、药理学、检体诊断学、实验诊断学、影像诊断学、西医内科学、西医外科学相近专业：针灸推拿学蒙医学藏医学针灸推拿主要实践教学环节毕业实习安排-般不少于48周培养目标本专业培养具备中医药理论基础、中医学专业知识和专业实践技能，能在各级中医院、中医科研机构及各级综合性医院等部门从事中医临床医疗工作和科学研究工作的医学高级专门人才。专业培养要求本专业学生主要学习中医药学基本理论知识和中医临床医疗技能，具备一定自然科学和现代医学的知识，受到中医临床技能和现代医学临床基本技能的训练，具有中医各科疾病的临床诊疗和科研工作的基本能力。毕业生具备的专业知识与能力1.掌握中医药基础理论和临床医学理论；2.掌握中药方剂学基本理论知识；3.掌握与中医学有关的现代科学技术和现代医学的基本知识；4.具有较熟练和准确运用四诊八纲、理法方药进行辨证论治的基本能力和对急重病症进行初步处理的能力；5.熟悉国家卫生工作方针、政策和法规；6.具有阅读中医古典医籍的能力。,"",
10,医学,1005,中医学类,100502k,针灸推拿学,本科,专业代码：100502K授予学位：医学学士修学年限：四年开设课程：主干学科：中医学、针灸推拿学。主要课程：中医学基础、人体解剖学、生物力学、中医古典医籍、经络学、刺灸学、手法学、功法学、中医内科学、神经病学、针灸临床治疗学、推拿临床治疗学等。相近专业：中医学蒙医学藏医学针灸推拿主要实践教学环节毕业实习安排-般不少于48周。培养目标本专业培养具备中医药理论基础、针灸推拿专业知识和实践技能，能在各级中医院、中医科研机构及综合性医院针灸等部门从事针灸、推拿医疗及科学研究工作的医学高级专门人才。专业培养要求本专业学生主要学习中医学基本理论知识和与本专业有关的现代科学技术、现代医学方面的基本知识，受到中医临床技能、针灸、推拿医疗技术等方面的基本训练，具有运用针灸、推拿诊疗各科疾病的基本能力。毕业生具备的专业知识与能力1.掌握中医学基础理论、临床医学知识以及主要的现代医学基本知识；2.掌握针灸、推拿的基本理论和操作技能；3.具有运用针灸、推拿处理临床各科疾病的初步能力；4.熟悉国家卫生工作的方针、政策和法规；5.了解中医学，尤其是针灸、推拿学的理论前沿和应用前景；6.掌握文献检索、资料查询的基本方法，具有初步的科学研究和实际工作能力。,"医学学士",
