一级专业代码,一级专业名称,二级专业代码,二级专业名称,三级专业代码,三级专业名称,类型,专业描述,授予学位,相近专业
56,装备制造大类,5603,自动化类,560305,工业网络技术,专科,专业代码：560305修学年限：三年开设课程：通信原理、数字信号处理、自动控制原理、计算机控制技术、计算机安全技术、计算机网络技术、工业网络技术、工业控制机工业网络技术主要实践教学环节通信原理、数字信号处理、自动控制原理、计算机控制技术、计算机安全技术、计算机网络技术、工业网络技术、工业控制机、金工实习、电子实习、电子技术课程设计、微机原理及接口技术课程设计、计算机网络实习、工业网络系统实习、毕业实习（设计）等，以及各校的主要特色课程和实践环节。工业网络技术培养目标培养掌握计算机与工业网络技术的基础知识和技能，能在生产企业从事工业控制计算机选型、安装、应用开发以及对工业网络操作和维护的高级技术应用性专门人才。工业网络技术毕业生具备的专业知识与能力工业网络技术的应用及工业网络的操作、维护与管理。,"", 自动化类 机电一体化技术 电气自动化技术 生产过程自动化技术 电力系统自动化技术 计算机控制技术 检测技术及应用 理化测试及质检技术 液压与气动技术 包装自动化技术
56,装备制造大类,5603,自动化类,560306,工业自动化仪表,专科,,,
56,装备制造大类,5603,自动化类,560307,液压与气动技术,专科,专业代码：560307修学年限：三年开设课程：机械制图、工程力学、流体力学、机械设计基础、电工与电子技术、机械制造技术基础、液气压传动与控制、电液比例及液压伺服系统、液压与气动设备的故障诊断、现代化设备的控制系统液压与气动技术主要实践教学环节机械制图、工程力学、流体力学、机械设计基础、电工与电子技术、机械制造技术基础、液气压传动与控制、电液比例及液压伺服系统、液压与气动设备的故障诊断、现代化设备的控制系统、机加工实习、电工实习、液压与气动课程设计、毕业实习（设计）等，以及各校的主要特色课程和实践环节。液压与气动技术培养目标培养从事机械、液压、气动设备的安装、调试、维修保养等技术管理工作，并且对一般机械、液压、气动系统具有设计能力的高级技术应用性专门人才。液压与气动技术专业培养要求掌握液压与气动的基础理论知识和专业技能，能在工业生产第一线从事液压与气动设备的安装、调试、维修、改造工作，并具备中、小型液压与气动产品的设计、开发、制造和调试能力的高等技术应用型专门人才。液压与气动技术毕业生具备的专业知识与能力液压与气动传动系统的设计，设备的维护、管理和应用开发。,"", 自动化类 机电一体化技术 电气自动化技术 生产过程自动化技术 电力系统自动化技术 计算机控制技术 工业网络技术 检测技术及应用 理化测试及质检技术 包装自动化技术
56,装备制造大类,5603,自动化类,560308,电梯工程技术,专科,,,
56,装备制造大类,5603,自动化类,560309,工业机器人技术,专科,,,
56,装备制造大类,5604,铁道装备类,560401,铁道机车车辆制造与维护,专科,,,
56,装备制造大类,5604,铁道装备类,560402,铁道通信信号设备制造与维护,专科,,,
56,装备制造大类,5604,铁道装备类,560403,铁道施工和养路机械制造与维护,专科,,,
56,装备制造大类,5605,船舶与海洋工程装备类,560501,船舶工程技术,专科,专业代码：560501修学年限：三年开设课程：工程力学、船体结构与制图、船舶电工基础、船舶与海洋工程材料、船舶原理、船舶焊接工艺、船舶设计基础、船舶CAD/CAM、专业英语、造船生产设计、船舶建造工艺、船舶舾装工程基础、船舶检验。船舶工程技术主要实践教学环节航海学、船舶值班与避碰、船舶操纵、航海仪器、航海气象与海洋学、船舶管理、船舶结构与设备、水上货物运输、业务与海商法、船艺训练、积载训练、航线设计、GMDSS训练、救生、消防、急救、安全实训、水手实习和毕业综合实训等，以及各学校的主要特色课程和实践环节。船舶工程技术培养目标培养掌握船舶驾驶和运输等方面的基础理论和基本技能，符合国际或国家颁布的相关职业标准，能从事海洋船舶驾驶工作的高级技术应用性专门人才。船舶工程技术毕业生具备的专业知识与能力船舶驾驶与管理技能。,"",
56,装备制造大类,5605,船舶与海洋工程装备类,560502,船舶机械工程技术,专科,,,
56,装备制造大类,5605,船舶与海洋工程装备类,560503,船舶电气工程技术,专科,,,
56,装备制造大类,5605,船舶与海洋工程装备类,560504,船舶舾装工程技术,专科,,,
56,装备制造大类,5605,船舶与海洋工程装备类,560505,船舶涂装工程技术,专科,,,
56,装备制造大类,5605,船舶与海洋工程装备类,560506,游艇设计与制造,专科,,,
56,装备制造大类,5605,船舶与海洋工程装备类,560507,海洋工程技术,专科,,,
56,装备制造大类,5605,船舶与海洋工程装备类,560508,船舶通信与导航,专科,,,
56,装备制造大类,5605,船舶与海洋工程装备类,560509,船舶动力工程技术,专科,,,
56,装备制造大类,5606,航空装备类,560601,飞行器制造技术,专科,,,
56,装备制造大类,5606,航空装备类,560602,飞行器维修技术,专科,,,
56,装备制造大类,5606,航空装备类,560603,航空发动机制造技术,专科,,,
56,装备制造大类,5606,航空装备类,560604,航空发动机装试技术,专科,,,
56,装备制造大类,5606,航空装备类,560605,航空发动机维修技术,专科,,,
56,装备制造大类,5606,航空装备类,560606,飞机机载设备制造技术,专科,,,
56,装备制造大类,5606,航空装备类,560607,飞机机载设备维修技术,专科,,,
56,装备制造大类,5606,航空装备类,560608,航空电子电气技术,专科,专业代码：560608修学年限：暂无信息开设课程：电工技术、模拟与数字电子技术、高频电子技术、微处理器的应用与实践、电视原理与技术、新型总线技术、电子测量与仪表、检测与传感技术、PCB设计与生产、电子产品分析与制作、数字系统设计与可编程器件等。航空电子电气技术培养目标具备电子设备的使用、安装、调试、运行和维修能力，PCB板的设计与制作能力，一般电子产品的初步设计能力，主要在家用电子、通信电子、航空电子等产业。,"", 民航运输类 民航运输 飞行技术 空中乘务 航空服务 民航商务 航空机电设备维修 航空电子设备维修 民航特种车辆维修 航空通信技术 空中交通管理 民航安全技术管理 航空油料管理和应用 飞机制造技术 航
56,装备制造大类,5606,航空装备类,560609,航空材料精密成型技术,专科,,,
56,装备制造大类,5606,航空装备类,560610,无人机应用技术,专科,,,
56,装备制造大类,5606,航空装备类,560611,导弹维修,专科,专业代码：560611修学年限：暂无信息开设课程：暂无信息导弹维修培养目标本专业培养适应现代导弹维修企业生产、管理第一线需要的，具有导弹维修必备的基础理论知识和专业知识，熟悉导弹的控制、制导和引信原理，掌握导弹的构造和修理技术，具有较强的导弹维修技能，德、智、体、美等方面全面发展的高等技术应用型专门人才。,"", 机电设备类 机电设备维修与管理 数控设备应用与维护 自动化生产设备应用 医用电子仪器与维护 医学影像设备管理与.. 医疗电子工程 设备安装技术 医用治疗设备应用技.. 冶金设备应用与维护 电气设备应
56,装备制造大类,5607,汽车制造类,560701,汽车制造与装配技术,专科,专业代码：560701修学年限：三年开设课程：机械制图、工程材料与成型工艺基础、机械设计基础、电工电子基础、汽车结构、汽车制造工艺学、汽车维修、汽车检测技术、汽车电子技术汽车制造与装配技术主要实践教学环节机械制图、工程材料与成型工艺基础、机械设计基础、电工电子基础、汽车结构、汽车制造工艺学、汽车维修、汽车检测技术、汽车电子技术、金工实习、机械设计基础课程设计、汽车制造工艺与装备课程设计、汽车制造与维修综合实训、毕业实习与毕业设计等，以及各校的主要特色课程和实践环节。汽车制造与装配技术培养目标本专业主要面向现代汽车制造及零部件生产与装配行业，培养德、智、体等全面发展，基础扎实、实践能力强的高等技术应用性人才。能从事现代汽车制造及零部件加工，汽车装配调试，具备从事计算机辅助设计、数控编程、产品质量检测等生产现场控制岗位的能力。汽车制造与装配技术专业培养要求1、具有本专业高级技术应用型人才所必需的文化素质和专业基础理论；2、具有正确使用各种测量器械和汽车零部件的加工与装配能力；3、具有数控编程、数控加工及数控机床保养与维护的能力；4、具有编制和实施典型汽车零件加工工艺与装配流程、分析解决一般机械加工工艺技术问题的基本能力；5、具有熟练使用各种与本专业相关的CAD、CAM、Pro/E、UG等软件能力，能胜任机械零件设计与简单机械设备设计工作；6、具备在制造企业担任生产车间（工段）或技术部门技术管理工作的能力。7、具有开拓创新的进取精神，一般具有中级数控机床汽车制造与装配技术毕业生具备的专业知识与能力汽车的制造与生产管理技术。,"", 汽车类 汽车检测与维修技术 汽车电子技术 汽车改装技术 汽车技术服务与营销 汽车整形技术 汽车运用与维修 摩托车制造与维修 汽车营销与维修 农业机械应用技术
56,装备制造大类,5607,汽车制造类,560702,汽车检测与维修技术,专科,专业代码：560702修学年限：三年开设课程：机械设计、机械检测、机械制造技术、机械设计、金属工艺学、电工原理、工程图学、电子技术、汽车概论、汽车构造、汽车电子电器设备、汽车检测与维修、汽车服务、汽车运用、汽车美容、发动机原理与汽车理论、汽车设计、汽车检测与故障诊断技术、汽车维修技术及设备、汽车发动机电控技术、汽车电器与电路、汽车营销管理学等。汽车检测与维修技术主要实践教学环节机械制图、工程材料与成型工艺基础、机械设计基础、电工电子基础、汽车结构、汽车制造工艺学、汽车维修、汽车检测技术、汽车电子技术、金工实习、机械设计基础课程设计、汽车制造工艺与装备课程设计、汽车制造与维修综合实训、毕业实习与毕业设计等，以及各校的主要特色课程和实践环节。汽车检测与维修技术培养目标教学计划培养适应社会主义现代化建设需要的德、智、体全面发展的，具备初步的汽车设计能力并能从事汽车制造、检测、维修、营销、管理、服务等方面工作的应用型、复合型工程技术人才。汽车检测与维修技术毕业生具备的专业知识与能力力学、机械工程、金属工艺学等基本理论和基本知识；掌握汽车及发动机构造及原理；具备对汽车及各部件、总成进行性能测试和分析的基本知识和基本技能；具有制订汽车制造及维修工艺及操作的基本能力；具有对汽车常见故障的判断和检测的初步能力；具备汽车技术服务的基本能力；具备企业技术经济分析和生产经营管理的初步能力。,"",
56,装备制造大类,5607,汽车制造类,560703,汽车电子技术,专科,专业代码：560703修学年限：三年开设课程：机械设计基础、发动机原理与汽车理论、电工技术、电子技术、汽车电子控制技术、汽车性能与实验、汽车运用与维修、机械设计基础课程设计、汽车拆装、汽车修理、汽车性能实验、汽车电子控制部件检测与调试汽车电子技术主要实践教学环节机械设计基础、发动机原理与汽车理论、电工技术、电子技术、汽车电子控制技术、汽车性能与实验、汽车运用与维修、机械设计基础课程设计、汽车拆装、汽车修理、汽车性能实验、汽车电子控制部件检测与调试、生产实习、毕业实习与毕业设计等，以及各校的主要特色课程和实践环节。汽车电子技术培养目标培养从事汽车等各类机动车的电器与电路的运行、调试、维修与技术管理等工作的高级技术应用性专门人才。汽车电子技术专业培养要求本专业学生除了学习必要的基本理论知识外，着重电控系统和电子电器设备模拟和数字电路等职业技能的实践、实训和创新能力的培养，突出电子技术的实用性和先进性，本专业培养熟悉汽车电子电器、电控系统故障诊断和维修的高级应用型技术人才。汽车电子技术毕业生具备的专业知识与能力汽车电器与电路的检修维护。,"",
57,生物与化工大类,5701,生物技术类,570101,食品生物技术,专科,专业代码：570101修学年限：三年开设课程：多数课程与省级高校特色专业（生物教育专业）共享；专业必修课程；上岗与专升本考试培训、食品加工、安全、检验等必选课群；观光旅游及园艺植物栽培、繁育等限选课群；专业技能、顶岗实习等实践项目。食品生物技术主要实践教学环节化学基础、微生物学基础、食品工程原理、生物工艺学、食品生物技术、酿酒工艺、酿造食品工艺、酶制剂、食品检验技术、化学分析技能鉴定、微生物培菌工技能鉴定、酿造工技能鉴定、食品检验工技能鉴定、综合实训、课程设计、毕业设计等，以及各校的主要特色课程和实践环节。食品生物技术培养目标培养能从事食品生物领域的生产与技术管理工作的高级技术应用性专门人才。食品生物技术毕业生具备的专业知识与能力具有分析解决食品生物技术应用中的工程技术和生产管理的能力。,"", 食品类 食品加工技术 食品营养与检测 食品贮运与营销 食品机械与管理 农畜特产品加工 粮食工程 食品卫生检验 食品分析与检验 食品加工及管理 食品检测及管理 酿酒技术 粮油储藏与检测技术 乳品工艺 
57,生物与化工大类,5701,生物技术类,570102,化工生物技术,专科,,,
57,生物与化工大类,5701,生物技术类,570103,药品生物技术,专科,,,
57,生物与化工大类,5701,生物技术类,570104,农业生物技术,专科,,,
57,生物与化工大类,5701,生物技术类,570105,生物产品检验检疫,专科,,,
57,生物与化工大类,5702,化工技术类,570201,应用化工技术,专科,专业代码：570201修学年限：三年开设课程：无机化学、有机化学、分析化学、物理化学、环境化学、化工制图、化工原理、化工热力学、化工设备机械基础、仪器分析、无机化学工艺、有机化学工艺、电工学、反应工程、CAD机械制图应用化工技术专业简介化工行业是国民经济重要产业，其产品广泛用于工业生产、人民生活、国防科技等领域，化工产业的发展对促进相关产业升级和拉动经济增长具有重要的作用。应用化工技术主要实践教学环节无机化学、有机化学、化工原理、化工热力学、化工传递过程、化学反应工程、化学分离工程、化工过程系统工程、工业催化等核心课程；化学与化工基础实验、认识实习、生产实习、课程设计、毕业实习、毕业设计等，以及各校的主要特色课程和实践环节。应用化工技术培养目标本专业以培养学生的基本素质、基本能力和创造性为出发点，培养具有坚实的化学工程与化学工艺方面的基本理论、基本知识和较强的实验技能，掌握精细化工、日用化工等基本原理和专业技能，能在科研机构、高等学校、科研院所及企事业单位，化轻工、医药、环保、日用化工及相关领域从事科学研究、产品开发、教学、工程设计、生产技术管理等工作，具有从事化工产品的研制与开发、化工装置的设计与放大、化工生产过程的控制与管理能力的高等工程技术人才。应用化工技术毕业生具备的专业知识与能力掌握无机化学、有机化学、分析化学和物理化学的基础理论知识和实验技能；掌握传递过程、分离工程、化学反应工程、化学工艺学的基本理论与实验技能；掌握化工生产过程和设备的基本原理与设计方法；具有化工技术经济分析和生产运行管理的基础知识；具有化工生产新工艺、新产品、新设备和新技术研究、开发与设计的初步能力。,"",
57,生物与化工大类,5702,化工技术类,570202,石油炼制技术,专科,,,
57,生物与化工大类,5702,化工技术类,570203,石油化工技术,专科,,,
57,生物与化工大类,5702,化工技术类,570204,高分子合成技术,专科,,,
57,生物与化工大类,5702,化工技术类,570205,精细化工技术,专科,,,
57,生物与化工大类,5702,化工技术类,570206,海洋化工技术,专科,,,
57,生物与化工大类,5702,化工技术类,570207,工业分析技术,专科,,,
57,生物与化工大类,5702,化工技术类,570208,化工装备技术,专科,,,
57,生物与化工大类,5702,化工技术类,570209,化工自动化技术,专科,,,
57,生物与化工大类,5702,化工技术类,570210,涂装防护技术,专科,,,
57,生物与化工大类,5702,化工技术类,570211,烟花爆竹技术与管理,专科,,,
57,生物与化工大类,5702,化工技术类,570212,煤化工技术,专科,,,
58,轻工纺织大类,5801,轻化工类,580101,高分子材料加工技术,专科,"专业代码：580101修学年限：三年开设课程：材料科学与工程基础、高分子化学及物理学、机械制造原理、高分子合金设计与制备、高分子材料成型原理、高分子材料成型机械、模具工程、高分子材料加工新技术、模具CAD/CAE/CAM、高分子材料加工工程专业实验、高分子材料成型装备控制技术、高分子结构与性能、计算机三维实体造型技术、先进复合材料等。高分子材料加工技术专业简介高分子材料加工技术专业服务于地方经济，以能力培养为主线，培养具有良好的职业道德和人品开拓技能，掌握高分子材料主要性能、加工方法、检测技术及相关应用技术，主要在高分子材料生产、加工、应用等相关领域从事生产、管理、质量检测、营销和服务的具有班组长潜质的高等技术应用型专门人才。高分子材料加工技术主要实践教学环节高分子材料化学基础（无机化学、有机化学、物理化学、高分子化学的整合）、机械基础（工程力学、机械零件与机械原理、金属工艺学的整合）、机电控制基础（电工与电子学、液压传动、机电控制技术、塑机控制技术的整合）、高分子物理、高分子材料分析与测试、高分子材料与配方技术、高分子材料加工工艺、高分子材料加工设备（橡胶加工设备、塑料成型设备）、高分子材料成型模具、钳工、金工实训、机电控制实习、专业生产实训、毕业综合实训等，以及各校的主要特色课程和实践环节。高分子材料加工技术培养目标培养在高分子材料成型加工领域，从事技术开发，工艺、设备与模具的设计、操作、维护与保养，生产与经营管理等工作的高级技术应用性专门人才。高分子材料加工技术专业培养要求高分子材料加工技术专业培养掌握高分子材料的合成、改性的方法；掌握高分子材料的组成、结构和性能关系;掌握聚合物加工流变学、成型加工工艺和成型模具设计的基本理论和基本技能;具有对高分子材料进行改性及加工工艺研究、设计和分析测试,并开发新型高分子材料及产品的初步能力;具有对高分子材料改性及加工过程进行技术经济分析和管理的初步能力。高分子材料加工技术毕业生具备的专业知识与能力新工艺的实施、新设备的应用能力。","",
58,轻工纺织大类,5801,轻化工类,580102,制浆造纸技术,专科,专业代码：580102修学年限：三年开设课程：植物纤维化学、制浆工艺、制浆造纸分析与检测、制浆造纸设备、加工纸工艺及设备、造纸厂仪表自动化、制浆造纸环境保护、专业英语、制浆造纸企业管理。制浆造纸技术专业简介制浆造纸工程专业是轻工技术与工程一级学科下的二级学科之一。该学科是以多种植物天然资源及产品为原材料，通过化学、物理和机械方法加工得到纸张等轻纺产品的生产技术与过程。制浆造纸工程主要研究制浆造纸的清洁生产技术、湿部化学与造纸助剂、应用型的制浆造纸生物技术、复合型的特种纸制造技术等，形成了该学科与多领域的交叉与融合。制浆造纸技术主要实践教学环节植物纤维化学、制浆工艺、制浆造纸分析与检测、制浆造纸设备、加工纸工艺及设备、造纸厂仪表自动化、制浆造纸环境保护、专业英语、制浆造纸企业管理、金工实习、认识实习、生产实习、毕业实习等，以及各校的主要特色课程和实践环节。制浆造纸技术培养目标培养面向现代造纸企业生产、管理和服务一线，掌握制浆造纸必需的基础知识和专业技能，从事制浆造纸等工作的高级技术应用性专门人才。制浆造纸技术专业培养要求制浆造纸技术专业培养既懂制浆造纸工艺、制浆造纸设备、制浆造纸分析与检验，又熟悉机电技术及高新技术在造纸机械控制上的应用，并熟悉相关学科；有较强实践能力、掌握制浆造纸常规工艺、分析和设备的运行技术又熟悉现代制浆造纸新技术。制浆造纸技术毕业生具备的专业知识与能力制浆造纸的生产技术与管理能力。,"", 轻化工类 染整技术 高分子材料加工技术 香料香精工艺 表面精饰工艺 皮革制品设计与工艺
58,轻工纺织大类,5801,轻化工类,580103,香料香精工艺,专科,专业代码：580103修学年限：三年开设课程：香料分析、香料生产过程及设备、香料基础知识、合成香料工艺、常用合成香料产品制备、香精调配技术、加香产品工艺、天然香料及其加工、香料分析与检测技术、香料生产设备工艺设计。香料香精工艺主要实践教学环节香料分析、香料生产过程及设备、香料基础知识、合成香料工艺、常用合成香料产品制备、香精调配技术、加香产品工艺、天然香料及其加工、香料分析与检测技术、香料生产设备工艺设计、金工实习、调香加香技能训练、香料调配合成实训、加香技术实训、毕业实习等，以及各校的主要特色课程和实践环节。香料香精工艺培养目标培养具有香料香精工艺必需的基础知识和基本技能，能从事香料合成、香精调配、日用化工品生产、应用，新产品开发及生产技术管理的高级技术应用性专门人才。香料香精工艺毕业生具备的专业知识与能力香料合成、调配能力。,"", 轻化工类 染整技术 高分子材料加工技术 制浆造纸技术 表面精饰工艺 皮革制品设计与工艺
58,轻工纺织大类,5801,轻化工类,580104,表面精饰工艺,专科,专业代码：580104修学年限：三年开设课程：金属学、电工电子技术、电化学测量、电镀工艺学、电镀层性能测试技术、电镀车间工艺设计、高分子与涂料、金属腐蚀与防护、涂装工艺技术、涂料与涂膜性能测试、三废处理、金工实习、电镀实习、镀层及涂膜性能测试、腐蚀测量与控制技术。表面精饰工艺主要实践教学环节金属学、电工电子技术、电化学测量、电镀工艺学、电镀层性能测试技术、电镀车间工艺设计、高分子与涂料、金属腐蚀与防护、涂装工艺技术、涂料与涂膜性能测试、三废处理、金工实习、电镀实习、镀层及涂膜性能测试、腐蚀测量与控制技术、毕业实习、毕业设计等，以及各校的主要特色课程和实践环节。表面精饰工艺培养目标培养掌握表面精饰工艺基本原理与基本技能，能从事表面精饰工艺操作、技术改造、工艺设计及生产技术管理的高级技术应用性专门人才。表面精饰工艺毕业生具备的专业知识与能力金属表面精饰（电镀与涂装）的实施能力及工艺设计能力。,"", 轻化工类 染整技术 高分子材料加工技术 制浆造纸技术 香料香精工艺 皮革制品设计与工艺
