一级专业代码,一级专业名称,二级专业代码,二级专业名称,三级专业代码,三级专业名称,类型,专业描述,授予学位,相近专业
08,工学,0802,机械类,080208,汽车服务工程,本科,专业代码：080208授予学位：工学学士修学年限：四年开设课程：英语、数学、计算机、电子学、电工学、机械制图、汽车构造、汽车电气设备，汽车故障诊断和检测、汽车运用和油材料、汽车维修行业法规及标准。相近专业：机械工程交通运输工程电子科学与技术主要实践教学环节包括军训、社会实践，课程设计，毕业设计(论文)等。培养目标本专业培养具有扎实的汽车技术和汽车服务理论基础，掌握一定的现代信息技术和经营管理的知识，熟悉相关法律法规，具备“懂技术、擅经营、会服务”的综合素质，能够适应汽车技术服务、贸易服务、金融服务等汽车服务领域工作的高级工程人才。专业培养要求本专业学生主要学习汽车技术、汽车运用、汽车服务等领域的基本理论知识，接受现代汽车诊断、检测与维修技术、汽车营销和其它汽车服务的系统训练，具有从事汽车技术服务及经营管理等工作的基本能力。毕业生具备的专业知识与能力1.有较扎实的自然科学基础、较好的沟通和文字的表达能力；2.较系统地掌握本专业领域宽广的技术理论基础知识，主要包括工程力学、计算机应用技术、机械设计、汽车构造、测试技术等基础知识；3.具有本专业必需的制图、测试、计算机应用、文献检索和基本工艺操作等基本技能；4.具有车辆工程领域必要的专业知识，了解其科学前沿及发展趋势；5.具有初步的科学研究、科技开发及组织管理能力；6.具有较强的自学能力和创新意识；,"工学学士",
08,工学,0802,机械类,080209T,机械工艺技术,本科,专业代码：080209T授予学位：工学学士修学年限：四年开设课程：机械制图与CAD、工程力学、机械设计基础、金属工艺学、.电工学与工业电子学、公差配合与测量技术等。相近专业：模具设计与制造专业计算机辅助设计与制造专业汽车摩托车的制造与维修专业主要实践教学环节包括主要课程实习、设计（毕业论文）等。培养目标本专业培养具有良好科学素养和古生物学理论知识，能从事机械工艺技术方面的工作，德、智、体全面发展的高级专业技术人才。专业培养要求本专业学生主要学习机械学的基本知识、基础理论和研究方法；了解当代机械学研究现状和发展方向；具有从事科学研究、高等教育、科技开发和行政管理能力和基本工作的能力。毕业生具备的专业知识与能力1.掌握机械学的基本知识和基本理论；2.了解当代机械学的研究现状和发展方向；3.掌握机械工艺技术基础理论和研究方法；4.具有从事科学研究、高等教育、科技开发的能力；5.熟练掌握一门外国语，具有交流沟通的能力；6.具有一定的归纳、整理、分析、设计、撰写论文的基本能力、进行学术交流的能力、较强的创新意识和创新精神。,"",
08,工学,0802,机械类,080210T,微机电系统工程,本科,专业代码：080210T授予学位：工学学士修学年限：四年开设课程：微机电工程材料、微机电器件与系统、微机械学、微纳米测量与测试技术、微细加工技术、现代传感技术、精密工程制造基础和光存储技术等。相近专业：机械设计制造及其自动化材料成型及控制工程工业设计制造工程过程装备与控制工程机械工程及自动化车辆工程汽车服务工程制造自动化与测控技术主要实践教学环节包括主要课程实习、设计（毕业论文）等。培养目标本专业主要培养从事微机电系统工程方面的设计制造，生产运行?科技开发和技术经济管理方面的人才。专业培养要求本专业学生主要学习微机电系统工程的基本知识、基础理论和研究方法；了解微机电系统工程发展方向；具有从事实际工作的基本能力。毕业生具备的专业知识与能力1.掌握微机电系统工程的基本知识和基本理论；2.了解微机电系统工程的发展方向；3.掌握微机电系统工程基础理论和研究方法；4.具有实际工作的基本能力；5.熟练掌握一门外国语，具有交流沟通的能力；6.具有一定的归纳、整理、分析、设计、撰写论文的基本能力、进行学术交流的能力、较强的创新意识和创新精神。,"工学学士", 机械类 机械设计制造及其自.. 材料成型及控制工程 机械电子工程 工业设计 过程装备与控制工程 车辆工程 汽车服务工程 农业机械化及其自动..
08,工学,0802,机械类,080211T,机电技术教育,本科,专业代码：080211T授予学位：工学学士修学年限：四年开设课程：力学、机械工程、控制工程、计算机科学与技术、画法几何与机械制图、工程力学、电工技术基础、电子技术基础、计算机辅助设计基础、机械学科教学论等。主要实践教学环节包括基础性工艺技能训练、专业各模块实习技能训练及强化训练、教育实习、专业考察、毕业设计等。　　培养目标本专业培养适应中等职业技术教育发展需要，掌握机电技术基础理论、基本知识和基本技能，具备较强的实践能力和创新精神，能在中等职业学校从事机电技术类课程教学及在相关行业从事设计和研究等工作的高级应用型人才。专业培养要求本专业要求学生具有坚定正确的政治方向，遵纪守法；树立服务社会、服务国家的理想和信念；具有良好的社会责任感和高尚的职业道德。具有本专业必需的机械、电子、自动控制、计算机科学与技术、机械加工技术以及教育学与心理学等方面的基础理论和基本技能。毕业生具备的专业知识与能力1.具有较扎实的机电技术基础理论、基本知识和基本技能；2.掌握机电技术教育的基本规律和教育教学的基本理论、方法和技能，能够胜任中等职业技术学校机电类专业的基础课、专业课的教学工作；3.具有一定的设计与研究能力，了解机电学科的发展前沿，具有一定的外文阅读能力，具有较宽的知识面和较强的适应能力；4.具有一定的体育和军事基本知识，具有健全的心理和健康的体魄。,"教育学学士", 秘书学 汽车维修工程教育 应用电子技术教育 服装设计与工艺教育 食品营养与检验教育 烹饪与营养教育 农艺教育 园艺教育 财务会计教育 市场营销教育 旅游管理与服务教育 工艺美术
08,工学,0802,机械类,080212T,汽车维修工程教育,本科,专业代码：080212T授予学位：工学学士修学年限：四年开设课程：力学、机械工程、车辆工程、画法几何与机械制图、工程力学、电工技术、电子技术、汽车理论、汽车构造、汽车发动机原理、汽车电器及电子设备、汽车检测技术、汽车故障诊断与维修等。主要实践教学环节包括基础性工艺技能训练、专业各模块实习技能训练及强化训练、生产实习、毕业实习、毕业设计等。　　培养目标本专业培养适应中等职业技术教育发展需要，掌握汽车技术基础理论和基本技能，具备较强的实践动手能力和创新精神，能从事汽车技术类课程教学及能从事汽车检测、维修、营销、设计、服务、金融保险等方面工作的高级应用型人才。专业培养要求本专业要求学生具有坚定正确的政治方向，遵纪守法；树立服务社会、服务国家的理想和信念；具有良好的社会责任感和高尚的职业道德。具有本专业必需的汽车制造、检测与维修、生产与管理、保险与服务等方面的基础理论和基本技能。毕业生具备的专业知识与能力1.掌握现代汽车技术及电气电子系统的结构和原理，能利用先进的设备检测和诊断汽车的性能及故障；2.掌握汽车驾驶技术及维修技能，熟练掌握汽车营销、售后服务、车辆评估与鉴定及汽车保险等技能；3.具有一定的机械零部件设计与研究能力，了解车辆工程的发展前沿，具有一定的外文阅读能力，具有较宽的知识面和较强的适应能力；4.具有一定的体育和军事基本知识，具有健全的心理和健康的体魄。,"教育学学士", 秘书学 汽车服务工程 机电技术教育 应用电子技术教育 服装设计与工艺教育 食品营养与检验教育 烹饪与营养教育 农艺教育 园艺教育 财务会计教育 市场营销教育 旅游管理与服务教育 工艺美术
08,工学,0803,仪器类,080301,测控技术与仪器,本科,专业代码：080301授予学位：工学学士修学年限：四年开设课程：精密机械与仪器设计、精密机械制造工程、模拟电子技术基础、数字电子技术基础，微型计算机原理与应用、控制工程基础、信号分析与处理、精密测控与系统等。主要实践教学环节包括军训、电子实习，认识实习，生产实习，社会实践，课程设计，毕业设计（论文）等，一般应安排40周以上。培养目标本专业培养具备精密仪器设计制造以及测量与控制方面基础知识与应用能力，能在国民经济各部门从事测量与控制领域内有关技术、仪器与系统的设计制造、科技开发、应用研究、运行管理等方面的高级工程技术人才。专业培养要求本专业学生主要学习精密仪器的光学、机械与电子学基础理论，测量与控制理论和有关测控仪器的设计方法，受到现代测控技术和仪器应用的训练，具有本专业测控技术及仪器系统的应用及设计开发能力。毕业生具备的专业知识与能力1.具有较扎实的自然科学基础，较好的人文、艺术和社会科学基础及正确运用本国语言、文字的表达能力；2.较系统地掌握本专业领域宽广的技术理论基础知识，主要包括机械学、电子学、光学、测量与控制、市场经济及企业管理等基础知识；3.掌握光、机、电、计算机相结合的当代测控技术和实验研究能力，具有本专业测控技术、仪器与系统的设计、开发能力；4.具有较强的外语应用能力；5.具有较强的自学能力、创新意识和较高的综合素质。,"工学学士",
08,工学,0804,材料类,080401,材料科学与工程,本科,专业代码：080401授予学位：工学学士修学年限：四年开设课程：物理化学、量子与统计力学、固体物理、材料学概论、材料科学基础、材料物理、材料化学、材料力学、材料科学研究方法、材料工艺与设备、计算机在材料科学中的应用等。相近专业：材料化学冶金工程金属材料工程无机非金属材料工程高分子材料与工程复合材料与工程焊接技术与工程宝石及材料工艺学粉体再生资源科学与技术稀土工程非织造材料与工程主要实践教学环节包括专业实验、金工实习、电工电子实习、认识实习、生产实习、课程设计、毕业设计。培养目标材料科学与工程专业培养具备包括金属材料、无机非金属材料、高分子材料等材料领域的科学与工程方面较宽的基础知识，能在各种材料的制备、加工成型、材料结构与性能等领域从事科学研究与教学、技术开发、工艺和设备设计、技术改造及经营管理等方面工作，适应社会主义市场经济发展的高层次、高素质全面发展的科学研究与工程技术人才。专业培养要求材料科学与工程专业学生主要学习材料科学与工程的基础理论，学习与掌握材料的制备、组成、组织结构与性能之间关系的基本规律。受到金属材料、无机非金属材料、高分子材料、复合材料以及各种先进材料的制备、性能分析与检测技能的基本训练。掌握材料设计和制备工艺设计、提高材料的性能和产品的质量、开发分析与检测技能的基本训练。掌握材料设计和制备工艺设计、提高材料的性能和产品的质量、开发研究新材料和新工艺方面的基本能力。毕业生具备的专业知识与能力1.掌握金属材料、无机非金属材料、高分子材料、防腐专业以及其它高新技术材料科学的基础理论和材料合成与制备、材料复合、材料设计等专业基础知识；2.掌握材料性能检测和产品质量控制的基本知识，具有研究和开发新材料、新工艺的初步能力；3.掌握材料加工的基本知识，具有正确选择设备进行材料研究、材料设计、材料研制的初步能力；4.具有本专业必需的机械设计、电工与电子技术、计算机应用的基本知识和技能；5.熟悉技术经济管理知识；6.掌握文献检索、资料查询的基本方法，具有初步的科学研究和实际工作能力。,"工学学士",
08,工学,0804,材料类,080402,材料物理,本科,专业代码：080402授予学位：工学或理学学士修学年限：四年开设课程：主干学科：材料科学、物理学主要课程：基础物理、近代物理、固体物理、材料物理学等。主要实践性教学环节：包括生产实习、毕业论文等，一般安排10-20周。相近专业：材料学主要实践教学环节包括生产实习、毕业论文等，一般安排10-20周。培养目标本专业培养较系统地掌握材料科学的基本理论与技术，具备材料物理相关的基本知识和基本技能，能在材料科学与工程及与其相关的领域从事研究、教学、科技开发及相关管理工作的材料物理高级专门人才。专业培养要求本专业学生主要学习材料科学方面的基本理论、基本知识和基本技能，受到科学思维与科学实验方面的基本训练，具有运用物理学和材料物理的基础理论、基本知识和实验技能进行材料研究和技术开发的基本能力。毕业生具备的专业知识与能力1.掌握数学、物理、化学等方面的基本理论和基本知识；2.掌握材料制备(或合成)、材料加工、材料结构与性能测定及材料应用等方面的基础知识、基本原理和基本实验技能；3.了解相近专业的一般原理和知识；4.熟悉国家关于材料科学与工程研究、科技开发及相关产业的政策，国内外知识产权等方面的法律法规；5.了解材料物理的理论前沿、应用前景和最新发展动态，以及材料科学与工程产业的发展状况；6.掌握中外文资料查询、文献检索以及运用现代信息技术获取相关信息的基本方法；具有一定的实验设计，创造实验条件，归纳、整理、分析实验结果，撰写论文，参与学术交流的能力。,"理学学士", 物理学类 物理学 应用物理学 核物理 声学 地球物理学类 地球物理学 材料成型及控制工程 材料类 材料科学与工程 材料化学 冶金工程 金属材料工程 无机非金属材料工程 高分子材料与工程 复合材料与工
08,工学,0804,材料类,080403,材料化学,本科,专业代码：080403授予学位：工学或理学学士修学年限：四年开设课程：在学习高等数学、化学、物理等基础理论知识及相关实验技能的基础上，本专业主要学习材料科学基础、结晶化学、高分子化学、高分子物理、材料研究与测试方法、材料性能学、材料化学、材料工艺学以及材料基础实验、材料化学专业实验等专业基础课和专业课，接受计算机课程模拟及应用，实验技能、信息获取、工程设计、科学研究等方面的技能培训。该课程体系设置使学生既掌握了材料化学方面的扎实宽广的基础理论知识又具备材料专业特长。相近专业：冶金工程金属材料工程无机非金属材料工程高分子材料与工程材料科学与工程复合材料与工程焊接技术与工程宝石及材料工艺学粉体再生资源科学与技术稀土工程非织造材料与工程主要实践教学环节包括生产实习、毕业论文等，一般安排10-20周。培养目标本专业培养系统掌握材料化学的基本理论与技术，具备材料化学相关的基本知识和基本技能，能运用化学和材料科学的基础理论、基本知识和实验技能在材料科学与化学及其相关的领域从事研究、教学、科技开发及相关管理工作的具有开拓型、前瞻性、复合型的高级人才。专业培养要求本专业学生主要学习材料科学方面的基本理论、基本知识和基本技能，受到科学思维与科学实验方面的基本训练，具有运用材料化学的基础理论、基本知识和实验技能进行材料研究和技术开发的基本能力。毕业生具备的专业知识与能力1.掌握数学、物理、化学等方面的基本理论和基本知识；2.掌握材料制备(或合成)、材料加工、材料结构与性能测定及材料应用等方面的基础知识、基本原理和基本实验技能；3.了解相近专业的一般原理和知识；4.熟悉国家关于材料科学与工程研究、科技开发及相关产业的政策，国内外知识产权等方面的法律法规；5.了解材料化学的理论前沿、应用前景和最新发展动态，以及材料科学与工程产业的发展状况；6.掌握中外文资料查询、文献检索以及运用现代信息技术获取相关信息的基本方法；具有一定的实验设计，创造实验条件，归纳、整理、分析实验结果，撰写论文，参与学术交流的能力。,"理学学士",
08,工学,0804,材料类,080404,冶金工程,本科,专业代码：080404授予学位：工学学士修学年限：四年开设课程：物理化学、金属学、冶金传输原理、冶金原理、钢铁冶金学、有色金属冶金学。相近专业：冶金物理化学有色金属冶金冶金科学技术史与冶金有关的专业主要实践教学环节包括金工实习、认识实习、生产实习、专业实验、计算机操作实验、课程设计、毕业实习、毕业设计(论文)。培养目标本专业培养具备冶金物理化学、钢铁冶金和有色金属冶金等方面的知识。能在冶金领域从事生产、设计、科研和管理工作的高级工程技术人才。专业培养要求本专业学生主要学习黑色和有色金属(包括重、轻、稀有和贵金属)冶金的基本理论、生产工艺和设备、实验研究、设计方法、环境保护及资源综合利用的基本理论和基本知识受到冶炼工艺制定、工程设计、测试技能和科学研究的基本训练。具有开发新技术，新工艺和新材料及工业设计和生产组织、管理的能力。毕业生具备的专业知识与能力1.掌握本专业所需的制图、机械、电工与电子技术和计算机应用的基本知识和技能；2.掌握黑色和有色金属冶金过程的基础理论和生产工艺知识；3.具有黑色和有色金属冶金生产组织、技术经济、科学管理、环境安全的基础知识和工业设计的初步能力；4.具有分析解决本专业生产中的实际问题以及进行科学研究，开发新技术、新工艺、新材料的初步能力；5.了解本专业和相关学科的科技发展动态。,"工学学士", 材料成型及控制工程 材料类 材料科学与工程 材料物理 材料化学 金属材料工程 无机非金属材料工程 高分子材料与工程 复合材料与工程 粉体材料科学与工程 宝石及材料工艺学 焊接技术与工程 功能材料 纳
08,工学,0804,材料类,080405,金属材料工程,本科,专业代码：080405授予学位：工学学士修学年限：四年开设课程：主干学科：材料科学与工程主要课程：材料热力学、金属学、材料力学性能、材料分析技术、金属材料学、材料成型加工工艺与设备、计算机在材料工程中的应用。相近专业：材料化学冶金工程材料科学与工程粉体再生资源科学与技术稀土工程非织造材料与工程高分子材料与工程宝石及材料工艺学无机非金属材料工程无机非金属材料工程复合材料与工程焊接技术与工程主要实践教学环节包括金工实习、生产实习、课程设计、专业实验、计算机应用及上机实践、毕业设计。培养目标本专业培养具备金属材料科学与工程等方面的知识，能在冶金、材料结构研究与分析、金属材料及复合材料制备、金属材料成型等领域从事科学研究、技术开发、工艺和设备设计、生产及经营管理等方面工作的高级工程技术人才。专业培养要求本专业学生主要学习材料科学的基础理论，掌握金属材料及其复合材料的成分、组织结构、生产工艺、环境与性能之间关系的基本规律。通过综合合金设计和工艺设计，提高材料的性质、质量和寿命，并开发新的材料及工艺。毕业生具备的专业知识与能力1、掌握材料科学的基础理论；2、掌握金属材料的专业基础理论知识；3、掌握金属材料的成型和加工工程的专业知识和技术经济管理知识；4、掌握金属材料制品的检测、产品质量控制和防护措施的基本知识和技能；5、具有金属材料的设计、选用及正确选择生产工艺及设备的初步能力；6、具有本专业必需的机械、电工与电子技术、计算机应用的基本知识和技能；7、具有研究开发新材料、新工艺和设备的初步能力。,"工学学士",
08,工学,0804,材料类,080406,无机非金属材料工程,本科,专业代码：080406授予学位：工学学士修学年限：四年开设课程：主干学科：材料科学与工程主要课程：物理化学、无机材料性能、测试及研究方法、粉体工程、材料制备原理、热工过程与设备、无机材料工艺学(含硅酸盐、复合材料)。相近专业：材料化学冶金工程金属材料工程高分子材料与工程材料科学与工程复合材料与工程焊接技术与工程宝石及材料工艺学再生资源科学与技术稀土工程非织造材料与工程主要实践教学环节包括专业实验、金工实习、生产实习(含毕业实习)、课程设计、计算机应用与上机实践、毕业设计(论文)。　培养目标本专业培养具备无机非金属材料及其复合材料科学与工程方面的知识，能在无机非金属材料结构研究与分析、材料的制备、材料成型与加工等领域从事科学研究、技术开发、工艺和设备设计、生产及经营管理等方面工作的高级工程技术人才。专业培养要求本专业学生主要学习无机非金属材料及复合材料的生产过程、工艺及设备的基础理论、组成、结构、性能及生产条件间的关系，具有材料测试、生产过程设计、材料改性及研究开发新产品、新技术和设备及技术管理的能力。毕业生具备的专业知识与能力1、掌握无机非金属材料的工业生产过程和设备、生产工艺的专业基础知识；2、掌握材料制备的原理及工艺基础，材料的结构与性能；3、掌握本专业所必需的机、电、微型计算机应用的基本知识技能；4、具有制品的工业生产、质量控制和技术管理的初步能力；5、具有正确选用材料、设备并进行工艺设计的能力；,"工学学士", 材料成型及控制工程 材料类 材料科学与工程 材料物理 材料化学 冶金工程 金属材料工程 高分子材料与工程 复合材料与工程 粉体材料科学与工程 宝石及材料工艺学 焊接技术与工程 功能材料 纳米材料与技
08,工学,0804,材料类,080407,高分子材料与工程,本科,专业代码：080407授予学位：工学学士修学年限：四年开设课程：主干学科：材料科学与工程主要课程：有机化学、物理化学、高分子化学、高分子物理、聚合物流变学、聚合物成型工艺、聚合物加工原理、高分子材料研究方法相近专业：材料学材料工程主要实践教学环节包括金工实习、生产实习、专业实验、计算机应用与上机实践、课程设计、毕业设计。培养目标本专业培养具备高分子材料与工程等方面的知识，能在高分子材料的合成改性和加工成型等领域从事科学研究、技术开发、工艺和设备设计、生产及经营管理等方面工作的高级工程技术人才。专业培养要求本专业学生主要学习高聚物化学与物理的基本理论和高分子材料的组成、结构与性能知识及高分子成型加工技术知识，从而具备高分子材料的研究和加工的基本技能。毕业生具备的专业知识与能力1.掌握高分子材料的合成、改性的方法；2.掌握高分子材料的组成、结构和性能关系；3.掌握聚合物加工流变学、成型加工工艺和成型模具设计的基本理论和基本技能；4.具有对高分子材料进行改性及加工工艺研究、设计和分析测试，并开发新型高分子材料及产品的初步能力；5.具有应用计算机的能力；6.具有对高分子材料改性及加工过程进行技术经济分析和管理的初步能力。,"工学学士",
